{
  "generated_at": "2026-04-10T12:20:15.720Z",
  "service": "web",
  "screens_path": "/home/sh/Documents/Github/template-fullstack-mono/client/web/src/lib/specScreens.json",
  "routes_path": "/home/sh/Documents/Github/template-fullstack-mono/client/web/src/lib/specRouteCatalog.json",
  "summary": {
    "total": 4,
    "direct": 4,
    "shared": 0,
    "stateful": 0,
    "missing": 0,
    "coverage_ratio": 1,
    "explicit_bindings": 4,
    "strong_evidence": 4,
    "medium_evidence": 0,
    "weak_evidence": 0,
    "with_notes": 4,
    "with_tags": 4,
    "duplicate_route_groups": 0
  },
  "duplicate_route_groups": [],
  "screens": [
    {
      "id": "TWEB_001",
      "title": "Web Landing",
      "route": "/",
      "status": "direct",
      "binding": "direct",
      "binding_source": "explicit",
      "coverage_state": "route_bound",
      "evidence_level": "strong",
      "route_defined": true,
      "has_notes": true,
      "has_tags": true,
      "duplicate_route_ids": [],
      "tags": [
        "public",
        "landing"
      ],
      "notes": [
        "Customer-facing landing route."
      ]
    },
    {
      "id": "TWEB_002",
      "title": "Web Login",
      "route": "/login",
      "status": "direct",
      "binding": "direct",
      "binding_source": "explicit",
      "coverage_state": "route_bound",
      "evidence_level": "strong",
      "route_defined": true,
      "has_notes": true,
      "has_tags": true,
      "duplicate_route_ids": [],
      "tags": [
        "public",
        "auth"
      ],
      "notes": [
        "Public login route."
      ]
    },
    {
      "id": "TWEB_003",
      "title": "Web Signup Choice",
      "route": "/signup",
      "status": "direct",
      "binding": "direct",
      "binding_source": "explicit",
      "coverage_state": "route_bound",
      "evidence_level": "strong",
      "route_defined": true,
      "has_notes": true,
      "has_tags": true,
      "duplicate_route_ids": [],
      "tags": [
        "public",
        "auth"
      ],
      "notes": [
        "Role selection before signup."
      ]
    },
    {
      "id": "TWEB_004",
      "title": "Web Support Notices",
      "route": "/support/notices",
      "status": "direct",
      "binding": "direct",
      "binding_source": "explicit",
      "coverage_state": "route_bound",
      "evidence_level": "strong",
      "route_defined": true,
      "has_notes": true,
      "has_tags": true,
      "duplicate_route_ids": [],
      "tags": [
        "public",
        "support"
      ],
      "notes": [
        "Public support notice list."
      ]
    }
  ]
}
