{
  "generated_at": "2026-04-10T12:20:49.906Z",
  "service": "admin",
  "screens_path": "/home/sh/Documents/Github/template-fullstack-mono/client/admin/src/lib/specScreens.json",
  "routes_path": "/home/sh/Documents/Github/template-fullstack-mono/client/admin/src/lib/specRouteCatalog.json",
  "summary": {
    "total": 2,
    "direct": 2,
    "shared": 0,
    "stateful": 0,
    "missing": 0,
    "coverage_ratio": 1,
    "explicit_bindings": 2,
    "strong_evidence": 2,
    "medium_evidence": 0,
    "weak_evidence": 0,
    "with_notes": 2,
    "with_tags": 2,
    "duplicate_route_groups": 0
  },
  "duplicate_route_groups": [],
  "screens": [
    {
      "id": "TADM_001",
      "title": "Admin Login",
      "route": "/login",
      "status": "direct",
      "binding": "direct",
      "binding_source": "explicit",
      "coverage_state": "route_bound",
      "evidence_level": "strong",
      "route_defined": true,
      "has_notes": true,
      "has_tags": true,
      "duplicate_route_ids": [],
      "tags": [
        "public",
        "auth"
      ],
      "notes": [
        "Public admin login route."
      ]
    },
    {
      "id": "TADM_002",
      "title": "Admin Forgot Password",
      "route": "/forgot-password",
      "status": "direct",
      "binding": "direct",
      "binding_source": "explicit",
      "coverage_state": "route_bound",
      "evidence_level": "strong",
      "route_defined": true,
      "has_notes": true,
      "has_tags": true,
      "duplicate_route_ids": [],
      "tags": [
        "public",
        "auth"
      ],
      "notes": [
        "Public admin password reset request route."
      ]
    }
  ]
}
